,quote,author,tags,likes
0,“Be yourself; everyone else is already taken.”,Oscar Wilde,"be-yourself,honesty,inspirational,misattributed-oscar-wilde",157508
1,"“I'm selfish, impatient and a little insecure. I make mistakes, I am out of control and at times hard to handle. But if you can't handle me at my worst, then you sure as hell don't deserve me at my best.”",Marilyn Monroe,"best,life,love,mistakes,out-of-control,truth,worst",155583
2,“Two things are infinite: the universe and human stupidity; and I'm not sure about the universe.”,Albert Einstein,"human-nature,humor,infinity,philosophy,science,stupidity,universe",137733
3,"“So many books, so little time.”",Frank Zappa,"books,humor",135088
4,“A room without books is like a body without a soul.”,Marcus Tullius Cicero,"books,simile,soul",125650
5,"“Be who you are and say what you feel, because those who mind don't matter, and those who matter don't mind.”",Bernard M. Baruch,"ataraxy,be-yourself,confidence,fitting-in,individuality,misattributed-dr-seuss,those-who-matter",123909
6,"“You've gotta dance like there's nobody watching,Love like you'll never be hurt,Sing like there's nobody listening,And live like it's heaven on earth.”",William W. Purkey,"dance,heaven,hurt,inspirational,life,love,sing",121935
7,“You know you're in love when you can't fall asleep because reality is finally better than your dreams.”,Dr. Seuss,"dreams,love,reality,sleep",118774
8,"“You only live once, but if you do it right, once is enough.”",Mae West,"humor,life",111573
9,“Be the change that you wish to see in the world.”,Mahatma Gandhi,"action,change,inspirational,philosophy,wish",109567
10,“In three words I can sum up everything I've learned about life: it goes on.”,Robert Frost,life,103727
11,"“If you want to know what a man's like, take a good look at how he treats his inferiors, not his equals.”","J.K. Rowling,
  

Harry Potter and the Goblet of Fire","character,sirius-black",98496
12,“Don’t walk in front of me… I may not followDon’t walk behind me… I may not leadWalk beside me… just be my friend”,Albert Camus,"friends,friendship,misattributed-albert-camus",88218
13,"“If you tell the truth, you don't have to remember anything.”",Mark Twain,"lies,lying,memory,truth",86742
14,"“Friendship ... is born at the moment when one man says to another ""What! You too? I thought that no one but myself . . .”","C.S. Lewis,
  

The Four Loves",friendship,85476
15,"“I've learned that people will forget what you said, people will forget what you did, but people will never forget how you made them feel.”",Maya Angelou,NA,82448
16,“A friend is someone who knows all about you and still loves you.”,Elbert Hubbard,"friend,friendship,knowledge,love",80326
17,“Always forgive your enemies; nothing annoys them so much.”,Oscar Wilde,"enemies,forgiveness,strategy",77689
18,"“To live is the rarest thing in the world. Most people exist, that is all.”",Oscar Wilde,life,77264
19,“Live as if you were to die tomorrow. Learn as if you were to live forever.”,Mahatma Gandhi,"carpe-diem,education,inspirational,learning",74688
20,“Darkness cannot drive out darkness: only light can do that. Hate cannot drive out hate: only love can do that.”,"Martin Luther King Jr.,
  

A Testament of Hope: The Essential Writings and Speeches","darkness,drive-out,hate,inspirational,light,love,peace",74597
21,"“Without music, life would be a mistake.”","Friedrich Nietzsche,
  

Twilight of the Idols","inspirational,music,philosophy",69599
22,“We accept the love we think we deserve.”,"Stephen Chbosky,
  

The Perks of Being a Wallflower","inspirational,love",69374
23,“I am so clever that sometimes I don't understand a single word of what I am saying.”,"Oscar Wilde,
  

The Happy Prince and Other Stories","intelligence,self-deprecation",68779
24,“To be yourself in a world that is constantly trying to make you something else is the greatest accomplishment.”,Ralph Waldo Emerson,"accomplishment,be-yourself,conformity,individuality",66721
25,"“Here's to the crazy ones. The misfits. The rebels. The troublemakers. The round pegs in the square holes. The ones who see things differently. They're not fond of rules. And they have no respect for the status quo. You can quote them, disagree with them, glorify or vilify them. About the only thing you can't do is ignore them. Because they change things. They push the human race forward. And while some may see them as the crazy ones, we see genius. Because the people who are crazy enough to think they can change the world, are the ones who do.”",Rob Siltanen,"advertising,apple,change,commercial,computers,different,madness,misattributed-apple,misattributed-steve-jobs,misfits,nonconformity,progressive,rebels,status-quo,think-different,troublemakers",66077
26,"“Insanity is doing the same thing, over and over again, but expecting different results.”",Narcotics Anonymous,"humor,insanity,life,misattributed-ben-franklin,misattributed-mark-twain,misattributed-to-einstein",62707
27,"“I believe that everything happens for a reason. People change so that you can learn to let go, things go wrong so that you appreciate them when they're right, you believe lies so you eventually learn to trust no one but yourself, and sometimes good things fall apart so better things can fall together.”",Marilyn Monroe,misattributed-marilyn-monroe,60452
28,“Twenty years from now you will be more disappointed by the things that you didn't do than by the ones you did do. So throw off the bowlines. Sail away from the safe harbor. Catch the trade winds in your sails. Explore. Dream. Discover.”,"H. Jackson Brown Jr.,
  

P.S. I Love You","actions,disappointed,disappointment,dream,dreams,explore,misattributed-mark-twain,sail",58047
29,“It is better to be hated for what you are than to be loved for what you are not.”,"Andre Gide,
  

Autumn Leaves","life,love",57358
30,"“Only once in your life, I truly believe, you find someone who can completely turn your world around. You tell them things that you’ve never shared with another soul and they absorb everything you say and actually want to hear more. You share hopes for the future, dreams that will never come true, goals that were never achieved and the many disappointments life has thrown at you. When something wonderful happens, you can’t wait to tell them about it, knowing they will share in your excitement. They are not embarrassed to cry with you when you are hurting or laugh with you when you make a fool of yourself. Never do they hurt your feelings or make you feel like you are not good enough, but rather they build you up and show you the things about yourself that make you special and even beautiful. There is never any pressure, jealousy or competition but only a quiet calmness when they are around. You can be yourself and not worry about what they will think of you because they love you for who you are. The things that seem insignificant to most people such as a note, song or walk become invaluable treasures kept safe in your heart to cherish forever. Memories of your childhood come back and are so clear and vivid it’s like being young again. Colours seem brighter and more brilliant. Laughter seems part of daily life where before it was infrequent or didn’t exist at all. A phone call or two during the day helps to get you through a long day’s work and always brings a smile to your face. In their presence, there’s no need for continuous conversation, but you find you’re quite content in just having them nearby. Things that never interested you before become fascinating because you know they are important to this person who is so special to you. You think of this person on every occasion and in everything you do. Simple things bring them to mind like a pale blue sky, gentle wind or even a storm cloud on the horizon. You open your heart knowing that there’s a chance it may be broken one day and in opening your heart, you experience a love and joy that you never dreamed possible. You find that being vulnerable is the only way to allow your heart to feel true pleasure that’s so real it scares you. You find strength in knowing you have a true friend and possibly a soul mate who will remain loyal to the end. Life seems completely different, exciting and worthwhile. Your only hope and security is in knowing that they are a part of your life.”",Bob Marley,love,55924
31,"“All that is gold does not glitter,Not all those who wander are lost;The old that is strong does not wither,Deep roots are not reached by the frost.From the ashes a fire shall be woken,A light from the shadows shall spring;Renewed shall be blade that was broken,The crownless again shall be king.”","J.R.R. Tolkien,
  

The Fellowship of the Ring","frost,glitter,gold,lost,poetry,roots,strength,strong,wander,wither",54547
32,"“It is our choices, Harry, that show what we truly are, far more than our abilities.”","J.K. Rowling,
  

Harry Potter and the Chamber of Secrets","abilities,choices",50189
33,"“The person, be it gentleman or lady, who has not pleasure in a good novel, must be intolerably stupid.”","Jane Austen,
  

Northanger Abbey","aliteracy,books,classic,humor",49248
34,"“Imperfection is beauty, madness is genius and it's better to be absolutely ridiculous than absolutely boring.”",Marilyn Monroe,"be-yourself,inspirational",48677
35,“There are only two ways to live your life. One is as though nothing is a miracle. The other is as though everything is a miracle.”,Albert Einstein,"inspirational,life,live,miracle,miracles",48299
36,“It does not do to dwell on dreams and forget to live.”,"J.K. Rowling,
  

Harry Potter and the Sorcerer's Stone","dreams,life",48008
37,"“Good friends, good books, and a sleepy conscience: this is the ideal life.”",Mark Twain,"books,contentment,friends,friendship,life",45670
38,"“As he read, I fell in love the way you fall asleep: slowly, and then all at once.”","John Green,
  

The Fault in Our Stars",love,45558
39,"“We are all in the gutter, but some of us are looking at the stars.”","Oscar Wilde,
  

Lady Windermere's Fan","inspirational,optimism,perception,pessimism",44108
40,"“Fairy tales are more than true: not because they tell us that dragons exist, but because they tell us that dragons can be beaten.”","Neil Gaiman,
  

Coraline","books,dragons,fairy-tales,inspirational,paraphrasing-g-k-chesterton",43694
41,"“It is better to remain silent at the risk of being thought a fool, than to talk and remove all doubt of it.”","Maurice Switzer,
  

Mrs. Goose, Her Book","misattributed-to-abraham-lincoln,misattributed-to-mark-twain,remaining-silent,wisdom",43693
42,"“The fool doth think he is wise, but the wise man knows himself to be a fool.”","William Shakespeare,
  

As You Like It",wisdom,43595
43,"“Whenever you find yourself on the side of the majority, it is time to reform (or pause and reflect).”",Mark Twain,"individuality,majority,minority,pause,reflect,wisdom",42967
44,“Life is what happens to us while we are making other plans.”,Allen Saunders,"fate,life,misattributed-john-lennon,planning,plans",42853
45,"“Yesterday is history, tomorrow is a mystery, today is a gift of God, which is why we call it the present.”",Bill Keane,"hope,inspirational,misattributed-eleanor-roosevelt,past,present,widely-misattributed",41596
46,"“I have not failed. I've just found 10,000 ways that won't work.”",Thomas A. Edison,"edison,failure,inspirational,paraphrased",40838
47,"“It is not a lack of love, but a lack of friendship that makes unhappy marriages.”",Friedrich Nietzsche,"friendship,lack-of-friendship,lack-of-love,love,marriage,unhappy-marriage",40236
48,"“The opposite of love is not hate, it's indifference. The opposite of art is not ugliness, it's indifference. The opposite of faith is not heresy, it's indifference. And the opposite of life is not death, it's indifference.”",Elie Wiesel,"activism,apathy,hate,indifference,inspirational,love,opposite,philosophy",40216
49,“A woman is like a tea bag; you never know how strong it is until it's in hot water.”,Eleanor Roosevelt,misattributed-eleanor-roosevelt,40135
50,“The man who does not read has no advantage over the man who cannot read.”,Mark Twain,"aliteracy,literacy",39845
51,“If you don't stand for something you will fall for anything.”,Gordon A. Eadie,"belief,integrity,misattributed-to-malcolm-x,misattributed-to-rosa-parks",38374
52,"“I may not have gone where I intended to go, but I think I have ended up where I needed to be.”","douglas adams,
  

The Long Dark Tea-Time of the Soul","life,navigation",38299
53,"“I love you without knowing how, or when, or from where. I love you simply, without problems or pride: I love you in this way because I do not know any other way of loving but this, in which there is no I or you, so intimate that your hand upon my chest is my hand, so intimate that when I fall asleep your eyes close.”","Pablo Neruda,
  

100 Love Sonnets","love,poetry",37969
54,“I solemnly swear that I am up to no good.”,"J.K. Rowling,
  

Harry Potter and the Prisoner of Azkaban",mischief,37699
55,"“Outside of a dog, a book is man's best friend. Inside of a dog it's too dark to read.”","Groucho Marx,
  

The Essential Groucho: Writings For By And About Groucho Marx","animals,books,dogs,friends,humor",37304
56,“I am enough of an artist to draw freely upon my imagination. Imagination is more important than knowledge. Knowledge is limited. Imagination encircles the world.”,Albert Einstein,"1929,imagination,inspirational,viereck-interview",36784
57,"“I like nonsense, it wakes up the brain cells. Fantasy is a necessary ingredient in living.”",Dr. Seuss,fantasy,36080
58,"“Love all, trust a few, do wrong to none.”","William Shakespeare,
  

All's Well That Ends Well","do-wrong,love,trust,wrong",36052
59,“Have you ever been in love? Horrible isn't it? It makes you so vulnerable. It opens your chest and it opens up your heart and it means that someone can get inside you and mess you up.”,"Neil Gaiman,
  

The Kindly Ones",love,35478
60,"“A day without sunshine is like, you know, night.”",Steve Martin,"humor,obvious,simile",34825
61,“Never put off till tomorrow what may be done day after tomorrow just as well.”,Mark Twain,"humor,procrastination",33977
62,"“A reader lives a thousand lives before he dies, said Jojen. The man who never reads lives only one.”","George R.R. Martin,
  

A Dance with Dragons","read,readers,reading,reading-books",33954
63,"“
The Paradoxical Commandments
People are illogical, unreasonable, and self-centered.Love them anyway.If you do good, people will accuse you of selfish ulterior motives.Do good anyway.If you are successful, you will win false friends and true enemies.Succeed anyway.The good you do today will be forgotten tomorrow.Do good anyway.Honesty and frankness make you vulnerable.Be honest and frank anyway.The biggest men and women with the biggest ideas can be shot down by the smallest men and women with the smallest minds.Think big anyway.People favor underdogs but follow only top dogs.Fight for a few underdogs anyway.What you spend years building may be destroyed overnight.Build anyway.People really need help but may attack you if you do help them.Help people anyway.Give the world the best you have and you'll get kicked in the teeth.Give the world the best you have anyway.”","Kent M. Keith,
  

The Silent Revolution: Dynamic Leadership in the Student Council","forgiveness,goodness,happiness,honesty,kindness,misattributed-to-mother-teresa,world",33761
64,“You have brains in your head. You have feet in your shoes. You can steer yourself any direction you choose. You're on your own. And you know what you know. And YOU are the one who'll decide where to go...”,"Dr. Seuss,
  

Oh, the Places You'll Go!",inspirational,33467
65,“That which does not kill us makes us stronger.”,Friedrich Nietzsche,"paraphrased,strength",33230
66,"“Being deeply loved by someone gives you strength, while loving someone deeply gives you courage.”",Lao Tzu,"courage,deeply-loved,love,strength,widely-misattributed",33118
67,“It is never too late to be what you might have been.”,George Eliot,"inspirational,source-unknown",32525
68,“For every minute you are angry you lose sixty seconds of happiness.”,Ralph Waldo Emerson,happiness,32163
69,"“It takes a great deal of bravery to stand up to our enemies, but just as much to stand up to our friends.”","J.K. Rowling,
  

Harry Potter and the Sorcerer's Stone","albus-dumbledore,courage,friends",31946
70,"“This life is what you make it. No matter what, you're going to mess up sometimes, it's a universal truth. But the good part is you get to decide how you're going to mess it up. Girls will be your friends - they'll act like it anyway. But just remember, some come, some go. The ones that stay with you through everything - they're your true best friends. Don't let go of them. Also remember, sisters make the best friends in the world. As for lovers, well, they'll come and go too. And baby, I hate to say it, most of them - actually pretty much all of them are going to break your heart, but you can't give up because if you give up, you'll never find your soulmate. You'll never find that half who makes you whole and that goes for everything. Just because you fail once, doesn't mean you're gonna fail at everything. Keep trying, hold on, and always, always, always believe in yourself, because if you don't, then who will, sweetie? So keep your head high, keep your chin up, and most importantly, keep smiling, because life's a beautiful thing and there's so much to smile about.”",Marilyn Monroe,"friends,heartbreak,inspirational,life,love,sisters",31651
71,“I love deadlines. I love the whooshing noise they make as they go by.”,"Douglas Adams,
  

The Salmon of Doubt","deadlines,humor,humour,work,writing",31512
72,"“If you judge people, you have no time to love them.”",Mother Teresa,,31141
73,"“There is never a time or place for true love. It happens accidentally, in a heartbeat, in a single flashing, throbbing moment.”","Sarah Dessen,
  

The Truth About Forever",love,30916
74,"“If you can't explain it to a six year old, you don't understand it yourself.”",Albert Einstein,"simplicity,understand",30260
75,"“I'm not upset that you lied to me, I'm upset that from now on I can't believe you.”",Friedrich Nietzsche,"lies,lying,trust",30094
76,“There is no greater agony than bearing an untold story inside you.”,"Maya Angelou,
  

I Know Why the Caged Bird Sings","1970,inspirational,stories,writing",29972
77,“Love is that condition in which the happiness of another person is essential to your own.”,"Robert A. Heinlein,
  

Stranger in a Strange Land","essential,happiness,love",29926
78,“Anyone who thinks sitting in church can make you a Christian must also think that sitting in a garage can make you a car.”,Garrison Keillor,"humor,religion",29487
79,“I have always imagined that Paradise will be a kind of library.”,Jorge Luis Borges,"books,library",29186
80,"“If you only read the books that everyone else is reading, you can only think what everyone else is thinking.”","Haruki Murakami,
  

Norwegian Wood","books,thought",29182
81,“Everything you can imagine is real.”,Pablo Picasso,"art,imagination,inspirational,life",28848
82,"“Women and cats will do as they please, and men and dogs should relax and get used to the idea.”",Robert A. Heinlein,"cats,humor,women",28256
83,"“We don't see things as they are, we see them as we are.”",Anaïs Nin,NA,27818
84,"“You may not be her first, her last, or her only. She loved before she may love again. But if she loves you now, what else matters? She's not perfect—you aren't either, and the two of you may never be perfect together but if she can make you laugh, cause you to think twice, and admit to being human and making mistakes, hold onto her and give her the most you can. She may not be thinking about you every second of the day, but she will give you a part of her that she knows you can break—her heart. So don't hurt her, don't change her, don't analyze and don't expect more than she can give. Smile when she makes you happy, let her know when she makes you mad, and miss her when she's not there.”",Bob Marley,love,27543
85,“Sometimes the questions are complicated and the answers are simple.”,Dr. Seuss,life,27542
86,“Never trust anyone who has not brought a book with them.”,"Lemony Snicket,
  

Horseradish","books,reading",27081
87,"“You love me. Real or not real?""I tell him, ""Real.”","Suzanne Collins,
  

Mockingjay","katniss,love,peeta,suzanne-collins,the-hunger-games",26997
88,“You can never get a cup of tea large enough or a book long enough to suit me.”,C.S. Lewis,"books,inspirational,reading,tea",26952
89,“We read to know we're not alone.”,"William Nicholson,
  

Shadowlands","misattributed-to-c-s-lewis,reading",26760
90,"“Sometimes, you read a book and it fills you with this weird evangelical zeal, and you become convinced that the shattered world will never be put back together unless and until all living humans read the book.”","John Green,
  

The Fault in Our Stars","books,power-of-words,reading",26562
91,“All you need is love. But a little chocolate now and then doesn't hurt.”,Charles M. Schulz,"chocolate,food,humor",26420
92,"“Of course it is happening inside your head, Harry, but why on earth should that mean that it is not real?”","J.K. Rowling,
  

Harry Potter and the Deathly Hallows",dumbledore,26100
93,“Beauty is in the eye of the beholder and it may be necessary from time to time to give a stupid or misinformed beholder a black eye.”,Jim Henson,humor,26087
94,"“Today you are You, that is truer than true. There is no one alive who is Youer than You.”","Dr. Seuss,
  

Happy Birthday to You!","comedy,life,yourself",25532
95,“Life isn't about finding yourself. Life is about creating yourself.”,George Bernard Shaw,"inspirational,life,yourself",25506
96,"“It is impossible to live without failing at something, unless you live so cautiously that you might as well not have lived at all—in which case, you fail by default.”",J.K. Rowling,NA,25458
97,"“To the well-organized mind, death is but the next great adventure.”","J.K. Rowling,
  

Harry Potter and the Sorcerer's Stone","death,dumbledore,harry,inspirational,philosophers-stone,ron,sorcerers-stone",25123
98,“I'm not afraid of death; I just don't want to be there when it happens.”,Woody Allen,"death,fear,humor,life",25072
99,"“If one cannot enjoy reading a book over and over again, there is no use in reading it at all.”",Oscar Wilde,"books,reading",24877
100,"“If you want your children to be intelligent, read them fairy tales. If you want them to be more intelligent, read them more fairy tales.”",Albert Einstein,"children,fairy-tales",24759
101,"“Have you fallen in love with the wrong person yet?'Jace said, ""Unfortunately, Lady of the Haven, my one true love remains myself.""...""At least,"" she said, ""you don't have to worry about rejection, Jace Wayland.""""Not necessarily. I turn myself down occasionally, just to keep it interesting.”","Cassandra Clare,
  

City of Bones","city-of-bones,jace",24401
102,“Logic will get you from A to Z; imagination will get you everywhere.”,Albert Einstein,imagination,24217
103,"“I'm in love with you,"" he said quietly.""Augustus,"" I said.""I am,"" he said. He was staring at me, and I could see the corners of his eyes crinkling. ""I'm in love with you, and I'm not in the business of denying myself the simple pleasure of saying true things. I'm in love with you, and I know that love is just a shout into the void, and that oblivion is inevitable, and that we're all doomed and that there will come a day when all our labor has been returned to dust, and I know the sun will swallow the only earth we'll ever have, and I am in love with you.”","John Green,
  

The Fault in Our Stars","doomed,inevitable,love,oblivion,pleasure,simple",24176
104,"“Whenever I feel the need to exercise, I lie down until it goes away.”",Paul   Terry,"exercise,humor,laziness,misattributed-to-hutchins",24116
105,"“I am nothing special, of this I am sure. I am a common man with common thoughts and I've led a common life. There are no monuments dedicated to me and my name will soon be forgotten, but I've loved another with all my heart and soul, and to me, this has always been enough..”","Nicholas Sparks,
  

The Notebook",love,23983
106,“Sometimes people are beautiful.Not in looks.Not in what they say.Just in what they are.”,"Markus Zusak,
  

I Am the Messenger","beauty,life",23871
107,“You don't get to choose if you get hurt in this world...but you do have some say in who hurts you. I like my choices.”,"John Green,
  

The Fault in Our Stars","satisfaction,self-determination",23725
108,"“The truth is, everyone is going to hurt you. You just got to find the ones worth suffering for.”",Bob Marley,friendship,23570
109,"“The more that you read, the more things you will know. The more that you learn, the more places you'll go.”","Dr. Seuss,
  

I Can Read With My Eyes Shut!","learning,reading,seuss",23548
110,"“Love looks not with the eyes, but with the mind,And therefore is winged Cupid painted blind.”","William Shakespeare,
  

A Midsummer Night's Dream",love,23477
111,“Folks are usually about as happy as they make their minds up to be.”,Abraham Lincoln,happiness,23467
112,"“Do what you can, with what you have, where you are.”",Theodore Roosevelt,inspirational,23254
